{
  "standard_version": "0.1.0",
  "compatible_theory": "0.1.8",
  "application_id": "grounded_pr_minimal",
  "artifacts": [
    {
      "id": "spec",
      "path": "specification.md",
      "sha256": "55bc61bfff5ab419910ed8bc8b666f8dcca4dd84f4f9245eeabf78ca05e94f20"
    },
    {
      "id": "argument",
      "path": "argument.md",
      "sha256": "4888c5ce31771c241fc44a4fd031afb710a456d54a0b42d033cacc1a65d8208d"
    }
  ],
  "regime": {
    "class": "EXACT_GR",
    "exactness_basis": "ANALYTIC",
    "descriptor_nondegenerate": true,
    "grounded": true,
    "forward_richness": "FORWARD_ACTIVE",
    "horizon": null,
    "eta": null,
    "qsd_claim_id": null,
    "claim_refs": [
      "regime"
    ]
  },
  "semantic_pipeline": {
    "pipeline_id": "sha256:3f58ff75d64147db58bad2e2f2d7255e030dca08f78d2bf95b05c78a172fa6c7",
    "bindings": {
      "typed_state": "spec",
      "state_sufficiency": "spec",
      "action_selection": "spec",
      "world_transition": "spec",
      "strategic_update": "spec",
      "feasible_actions": "spec",
      "regime_region": "spec",
      "initial_basin": "spec",
      "descriptor": "spec",
      "limiting_law": "spec",
      "convergence_mode": "spec",
      "relevance_map": "spec",
      "property_map": "spec",
      "comparison_set": "spec",
      "component_grammar": "spec",
      "hard_structural_relations": "spec",
      "semantic_transport_rules": "spec",
      "model_set_rule": "spec",
      "inference_procedure": "spec",
      "clock_state": null
    },
    "components": [
      {
        "id": "alpha",
        "kind": "ACTION_SELECTION"
      },
      {
        "id": "P",
        "kind": "WORLD_TRANSITION"
      },
      {
        "id": "U",
        "kind": "STRATEGIC_UPDATE"
      },
      {
        "id": "feasibility",
        "kind": "FEASIBILITY"
      }
    ],
    "selection_status": "FROZEN_REGISTERED",
    "frozen_at": "2026-09-01T00:00:00Z",
    "evaluation_started_at": "2026-09-02T00:00:00Z",
    "registration_ref": null,
    "selection_adjustment_ref": null
  },
  "interventions": [
    {
      "id": "J0",
      "type": "ACTION_SELECTION",
      "target_form": "ATOMIC",
      "target_components": [
        "alpha"
      ],
      "effective_target_components": [
        "alpha"
      ],
      "held_fixed_components": [
        "P",
        "U",
        "feasibility"
      ],
      "replacement_ref": "spec",
      "hard_target_closure_ref": "spec",
      "schedule": "STATIONARY",
      "formal_admissibility": "ADMISSIBLE",
      "reachable_support": "NOT_APPLICABLE",
      "causal_modularity": "NOT_APPLICABLE"
    }
  ],
  "provenance_graph": {
    "nodes": [
      {
        "id": "primitives",
        "kind": "DECLARED_IDENTITY_OR_AXIOM",
        "artifact_ref": "spec",
        "depends_on": [],
        "description": "Declared synthetic model primitives; no empirical warrant."
      },
      {
        "id": "regime",
        "kind": "CLAIM",
        "artifact_ref": "argument",
        "depends_on": [
          "primitives"
        ],
        "description": "Analytic regime argument, independently readable in the artifact."
      },
      {
        "id": "effect",
        "kind": "CLAIM",
        "artifact_ref": "argument",
        "depends_on": [
          "primitives"
        ],
        "description": "Analytic effect argument; not machine-proved by this validator."
      }
    ]
  },
  "identified_set": {
    "id": "M",
    "kind": "POINT_IDENTIFIED",
    "nonempty": true,
    "rule_ref": "spec",
    "inference_procedure_ref": "spec",
    "comparison_set_ref": "spec",
    "quantification": "ALL_MODELS_ALL_COMPARISON_STATES",
    "sampling_applicable": false,
    "coverage": "NOT_APPLICABLE",
    "zero_effect": "EXCLUDED",
    "direction": "NEGATIVE",
    "uniform_gap": {
      "status": "ESTABLISHED",
      "lower_bound": "1/2",
      "claim_refs": [
        "effect"
      ]
    },
    "claim_refs": [
      "effect"
    ]
  },
  "certificate": {
    "validity": "VALID",
    "epistemic_mode": "FORMAL_THEORETICAL",
    "selection_status": "FROZEN_REGISTERED",
    "identification_status": "POINT_IDENTIFIED",
    "statistical_status": "NOT_APPLICABLE",
    "provenance_status": "NOT_APPLICABLE",
    "substantive_pr_status": "ROBUST_PR",
    "direction_status": "NEGATIVE",
    "uniform_gap_status": "ESTABLISHED",
    "pipeline_id": "sha256:3f58ff75d64147db58bad2e2f2d7255e030dca08f78d2bf95b05c78a172fa6c7",
    "scope": "FROZEN_PROTOCOL",
    "intervention_id": "J0",
    "claim_refs": [
      "effect"
    ]
  }
}
